en,it,fr,es,ja,hi,zh-cn
protein powder tools,Strumenti di polvere proteica,Outils de poudre de protéines,herramientas de polvo de proteínas,プロテインパウダーツール,प्रोटीन पाउडर उपकरण,蛋白粉工具
protein powder apps,App di polvere proteica,Applications de poudre de protéines,aplicaciones de proteínas en polvo,プロテインパウダーアプリ,प्रोटीन पाउडर ऐप्स,蛋白质粉末应用
protein powder software,software di polvere proteica,logiciel de poudre de protéines,software de proteína en polvo,プロテインパウダーソフトウェア,प्रोटीन पाउडर सॉफ्टवेयर,蛋白粉软件
protein powder solutions,soluzioni di polvere proteica,Solutions de poudre de protéines,soluciones de proteína en polvo,プロテインパウダーソリューション,प्रोटीन पाउडर समाधान,蛋白质粉末溶液
protein powder services,Servizi di polvere proteica,services de poudre de protéines,Servicios de polvo de proteínas,プロテインパウダーサービス,प्रोटीन पाउडर सेवाएं,蛋白质粉末服务
protein powder platforms,piattaforme di polvere proteica,plates-formes de poudre de protéines,plataformas de polvo de proteínas,プロテインパウダープラットフォーム,प्रोटीन पाउडर प्लेटफार्म,蛋白质粉末平台
vitamin D tools,Strumenti di vitamina D.,outils de vitamine D,Herramientas de vitamina D,ビタミンDツール,विटामिन डी उपकरण,维生素D工具
vitamin D apps,App di vitamina D.,applications de vitamine D,aplicaciones de vitamina D,ビタミンDアプリ,विटामिन डी ऐप्स,维生素D应用
vitamin D software,software di vitamina D.,logiciel de vitamine D,software de vitamina D,ビタミンDソフトウェア,विटामिन डी सॉफ्टवेयर,维生素D软件
vitamin D solutions,Soluzioni di vitamina D.,Solutions de vitamine D,soluciones de vitamina D,ビタミンDソリューション,विटामिन डी समाधान,维生素D溶液
vitamin D services,Servizi di vitamina D.,services de vitamine D,Servicios de vitamina D,ビタミンDサービス,विटामिन डी सेवाएँ,维生素D服务
vitamin D platforms,piattaforme di vitamina D.,plates-formes de vitamine D,plataformas de vitamina D,ビタミンDプラットフォーム,विटामिन डी प्लेटफ़ॉर्म,维生素D平台
healthy diet tools,Strumenti dietetici sani,outils de régime sain,Herramientas de dieta saludables,健康的なダイエットツール,स्वस्थ आहार उपकरण,健康的饮食工具
healthy diet apps,App dietetiche sane,applications de régime sain,aplicaciones de dieta saludables,健康的なダイエットアプリ,स्वस्थ आहार ऐप,健康的饮食应用程序
healthy diet software,software dietetico sano,logiciel de régime sain,Software de dieta saludable,健康的なダイエットソフトウェア,स्वस्थ आहार सॉफ्टवेयर,健康的饮食软件
healthy diet solutions,soluzioni dietetiche sane,solutions de régime saines,Soluciones de dieta saludables,健康的なダイエットソリューション,स्वस्थ आहार समाधान,健康的饮食解决方案
healthy diet services,Servizi dietetici sani,Services de régime sain,Servicios de dieta saludables,健康的なダイエットサービス,स्वस्थ आहार सेवाएँ,健康的饮食服务
healthy diet platforms,piattaforme dietetiche sane,plates-formes de régime sain,plataformas de dieta saludables,健康的なダイエットプラットフォーム,स्वस्थ आहार मंच,健康的饮食平台
